{
  "id": "q_fgi_legal_brand_benefits",
  "title": "FGI - 변호사 내용증명 서비스: 브랜드 인식 및 혜택 경험",
  "instructions": "모더레이터 가이드: (1) 참여자가 법률 서비스를 '어렵고 비싼 것'으로 느끼지 않도록 편안한 분위기를 조성하세요. (2) '변호사 명의'가 주는 심리적 안도감과 실제 효력에 대한 기대를 구분해 질문하세요. (3) 가격 할인, 환불 보장 등 상업적 혜택이 법률 서비스의 신뢰도에 미치는 영향을 탐색하세요.",
  "questions": [
    { "id": "q1", "text": "워밍업) '내용증명'이나 '법률 문서 작성' 하면 떠오르는 이미지가 있나요? (예: 빨간 딱지, 복잡함, 비쌈, 든든함 등)", "kind": "open" },
    { "id": "q2", "text": "브랜드/명의 효과) '본인 이름'으로 보낼 때와 '변호사 이름'이 찍혀서 나갈 때, 상대방(수신인)이 느낄 압박감이 얼마나 다를 것이라 예상하나요? (1=차이 없음, 7=매우 큰 차이)", "kind": "scale", "scale_min": 1, "scale_max": 7 },
    { "id": "q3", "text": "가격 민감도) 100% 셀프 작성(무료) vs 변호사 검수 및 발송 대행(10~20만원) vs 변호사 직접 작성(30~50만원). 본인의 상황이라면 어떤 옵션을 선택할 것 같나요? 그 이유는?", "kind": "open" },
    { "id": "q4", "text": "할인 프로모션) 법률 서비스에서 '첫 구매 할인', '1+1(추가 발송 무료)' 같은 혜택을 본다면 어떤 느낌이 드나요? (합리적이다 vs 전문성이 떨어져 보인다)", "kind": "open" },
    { "id": "q5", "text": "안심 혜택) '상대방 무응답 시 수수료 환불' 또는 '소송 연결 시 비용 차감' 같은 조건이 서비스 선택에 얼마나 영향을 미칠까요? (1=영향 없음, 7=결정적 영향)", "kind": "scale", "scale_min": 1, "scale_max": 7 },
    { "id": "q6", "text": "급행 서비스) '24시간 내 발송 보장' 같은 급행 서비스에 추가 비용(예: 3~5만원)을 지불할 의향이 있나요?", "kind": "open" },
    { "id": "q7", "text": "서비스 신뢰 요소) 온라인 법률 서비스를 이용할 때 가장 신뢰를 주는 요소는 무엇인가요? (복수 선택)", "kind": "multi", "options": ["변호사 실명/사진 공개", "누적 발송 건수/성공 사례", "실제 이용자 후기", "환불/보장 정책", "언론 보도/제휴", "사이트 디자인/UI"] },
    { "id": "q8", "text": "비대면의 한계) 변호사를 직접 만나지 않고 온라인/전화로만 처리하는 것에 대한 불안감은 어느 정도인가요? 해소되려면 무엇이 필요할까요?", "kind": "open" },
    { "id": "q9", "text": "재이용/추천 의향) 만족스러운 결과를 얻었다면, 주변에 비슷한 문제를 겪는 지인에게 이 온라인 서비스를 추천할 의향이 있나요? (1=비추천, 7=강력 추천)", "kind": "scale", "scale_min": 1, "scale_max": 7 },
    { "id": "q10", "text": "개선 아이디어) 법률 서비스의 문턱을 낮추기 위해 제공되었으면 하는 혜택이나 기능이 있다면 자유롭게 말씀해 주세요.", "kind": "open" }
  ]
}
