{
  "id": "q_fgi_brand_benefits_001",
  "title": "FGI - 브랜드 혜택/프로모션(할인·1+1·드라마팅) 경험 토론 가이드",
  "instructions": "모더레이터 가이드: (1) 한 번에 한 문항씩 제시하고 발화 순서를 라운드마다 회전하세요. (2) 각 발화는 60~90초 내, 구체적 맥락(어디서 봤는지·무엇을 했는지·결과)을 요청하세요. (3) 드라마팅(한정 수량·타이머·전용 혜택 등)의 영향을 탐색하되, 과장/피로/불신 포인트도 함께 짚어주세요. (4) 민감 정보는 묻지 않으며, 빠른 손들기(스케일/멀티)로 집단 감도를 간간이 확인하세요. (5) 답변은 120단어(또는 3~5문장) 이내로 제한합니다.",
  "questions": [
    { "id": "q1", "text": "워밍업) 최근 1~2개월 내 기억나는 ‘브랜드 혜택/프로모션’(할인, 1+1, 쿠폰, 적립, 한정판/타임딜 등)은 무엇이었나요? 어디서 보셨나요?", "kind": "open" },
    { "id": "q2", "text": "가장 인상 깊은 혜택) 가장 기억에 남는 혜택 1가지를 골라, 노출 맥락(앱/웹/오프라인/소셜), 메시지, 실제 행동(클릭/방문/구매/무시)을 짧게 설명해 주세요.", "kind": "open" },
    { "id": "q3", "text": "드라마팅 요소) 카운트다운, 한정 수량, ‘지금만’, ‘나만을 위한’ 등 드라마팅이 행동에 어떤 영향을 줬나요? 긍정/부정 각각 한 가지씩 사례로 말씀해 주세요.", "kind": "open" },
    { "id": "q4", "text": "적용/사용 흐름) 해당 혜택을 실제로 적용(쿠폰 다운로드/체크아웃 적용/현장 제시 등)하는 과정에서 겪은 단계와 마찰(헷갈림, 조건 숨김, 예외 등)을 설명해 주세요.", "kind": "open" },
    { "id": "q5", "text": "가치 체감) ‘표시된 혜택’ 대비 실제 ‘얻은 가치(가격·품질·경험)’는 어느 정도였나요? (1=전혀 가치 없었다, 7=기대 이상으로 가치 있었다)", "kind": "scale", "scale_min": 1, "scale_max": 7 },
    { "id": "q6", "text": "신뢰/공정성) 혜택 조건(최소금액, 특정 카테고리 제외, 신규 한정 등)이 충분히 명확/공정했다고 느끼셨나요? (1=매우 불공정/불명확, 7=매우 공정/명확)", "kind": "scale", "scale_min": 1, "scale_max": 7 },
    { "id": "q7", "text": "발견 채널) 주로 혜택을 어디서 발견하나요? 해당되는 모든 항목을 선택해 주세요.", "kind": "multi", "options": ["앱 홈/배너", "검색/카테고리 페이지", "상품 상세", "체크아웃 단계", "푸시 알림", "이메일/문자", "인앱 메시지", "인플루언서/브랜디드 콘텐츠", "SNS/디스플레이 광고", "오프라인 매장", "지인 추천", "기타"] },
    { "id": "q8", "text": "선호 혜택 유형) 상대적으로 선호/허용하는 혜택 유형을 모두 선택해 주세요.", "kind": "multi", "options": ["정률 할인(%)", "정액 할인(원)", "1+1/덤 증정", "무료배송", "적립/포인트", "번들/세트", "체험판/트라이얼", "캐시백/페이백", "한정판/타임딜/드롭", "구독자 전용", "친환경/사회공헌 연계", "기타"] },
    { "id": "q9", "text": "개인화 체감) 이 혜택이 ‘나를 위해 맞춤 제공’되었다고 느낀 정도는? (1=전혀 아님, 7=매우 그렇다)", "kind": "scale", "scale_min": 1, "scale_max": 7 },
    { "id": "q10", "text": "피로/압박감) 드라마팅 메시지(긴급·한정·지금만)는 피로감 또는 압박감을 어느 정도 주나요? (1=전혀 없음, 7=매우 큼)", "kind": "scale", "scale_min": 1, "scale_max": 7 },
    { "id": "q11", "text": "브랜드 이미지 영향) 해당 혜택/프로모션이 브랜드에 대한 신뢰/호감/프리미엄 이미지에 어떤 변화를 줬나요? (+/- 사례 각각 1개)", "kind": "open" },
    { "id": "q12", "text": "성공 여정) 혜택이 실제 구매/가입/방문으로 이어진 최근 사례를, 트리거→탐색→비교→결정→결과 흐름으로 짧게 서술해 주세요.", "kind": "open" },
    { "id": "q13", "text": "무산 요인) 혜택을 보고도 행동으로 이어지지 않은 이유(조건/복잡도/신뢰/가격 외 요인 등)를 구체적 사례로 설명해 주세요.", "kind": "open" },
    { "id": "q14", "text": "빈도 허용치) 같은 브랜드/플랫폼의 혜택 노출 빈도가 어느 수준까지는 괜찮나요? (1=매우 낮아야 함, 7=자주여도 무방)", "kind": "scale", "scale_min": 1, "scale_max": 7 },
    { "id": "q15", "text": "개선 아이디어) 혜택 메시지/설계/적용 흐름에서 꼭 바꾸고 싶은 한 가지를 제안해 주세요. (텍스트·UI·정책·타깃팅·설명성 등)", "kind": "open" },
    { "id": "q16", "text": "추가 의견) 오늘 주제(브랜드 혜택/프로모션)에 대해 더 전하고 싶은 경험이나 의견이 있으면 자유롭게 말씀해 주세요.", "kind": "open" }
  ]
}


