{
  "id": "q_fgi_legal_ads_trust",
  "title": "FGI - 법률 서비스 광고 및 플랫폼 신뢰도 조사",
  "instructions": "모더레이터 가이드: (1) 참여자들이 접한 온라인 법률 광고(블로그, 인스타, 유튜브 등) 경험을 상기시켜 주세요. (2) '자극적인 문구(승소율 100%, 떼인 돈 받아드립니다)'에 대한 거부감과 호기심을 동시에 탐색하세요. (3) 플랫폼(로톡 등)과 개별 변호사 사무실에 대한 신뢰도 차이를 비교해 보세요.",
  "questions": [
    { "id": "q1", "text": "워밍업) 최근 3개월 내에 법률 관련 광고(블로그, 배너, 영상 등)를 본 기억이 있나요? 어디서 보셨나요?", "kind": "open" },
    { "id": "q2", "text": "광고 이미지) '떼인 돈 받아드립니다', '이혼 전문' 같은 직관적이고 자극적인 문구의 광고를 볼 때 드는 생각은? (신뢰감 vs 거부감)", "kind": "open" },
    { "id": "q3", "text": "정보 탐색 경로) 법률 문제가 생겼을 때 가장 먼저 정보를 찾는 곳은 어디인가요?", "kind": "multi", "options": ["네이버/구글 검색(지식인, 블로그)", "유튜브 법률 채널", "법률 플랫폼(로톡 등)", "지인 추천", "커뮤니티/카페", "기타"] },
    { "id": "q4", "text": "플랫폼 신뢰도) '법률 플랫폼'에서 추천해주는 변호사와 '지인이 추천'해주는 변호사 중 누구를 더 신뢰하나요? 그 이유는?", "kind": "open" },
    { "id": "q5", "text": "후기/평점) 변호사 상담/수임 후기를 볼 때 가장 중요하게 보는 포인트는? (승소 결과, 친절함, 연락 속도, 비용 투명성 등)", "kind": "open" },
    { "id": "q6", "text": "전문성 판단) 이 변호사가 내 문제를 잘 해결해줄 '전문가'라고 판단하는 기준은 무엇인가요? (성공 사례 수, 출신 학교/경력, 미디어 출연, 상담 태도 등)", "kind": "open" },
    { "id": "q7", "text": "비용 투명성) 광고에 '수임료 정찰제'나 '상담료 공개'가 되어 있는 경우, 신뢰도에 어떤 영향을 미치나요? (1=부정적, 7=매우 긍정적)", "kind": "scale", "scale_min": 1, "scale_max": 7 },
    { "id": "q8", "text": "개인정보 우려) 온라인으로 내 사건 내용(민감 정보)을 입력하여 견적을 받는 과정에서 개인정보 유출 우려는 어느 정도인가요? (1=전혀 없음, 7=매우 큼)", "kind": "scale", "scale_min": 1, "scale_max": 7 },
    { "id": "q9", "text": "과대 광고) '무조건 승소', '최저가 보장' 등의 문구가 실제 선택에 미치는 영향은? (오히려 의심하게 된다 vs 일단 클릭하게 된다)", "kind": "open" },
    { "id": "q10", "text": "이상적인 광고) 법률 소비자로서 가장 도움이 되고 신뢰가 가는 광고/콘텐츠 유형은 어떤 것인가요? (예: 해결 사례 분석 콘텐츠, 변호사 브이로그, Q&A 등)", "kind": "open" },
    { "id": "q11", "text": "수임료 또는 상담료 할인/이벤트 혜택이 법률 서비스 선택에 어느 정도 영향을 미칠까요? (1=영향 없음, 7=결정적 영향)", "kind": "scale", "scale_min": 1, "scale_max": 7 },
    { "id": "q12", "text": "온라인 광고를 보고 실제로 법률 상담 또는 수임까지 연결된 경험이 있나요? 있었다면 어떤 부분이 결정에 영향을 주었나요?", "kind": "open" }
  ]
}
