{
    "id": "q_fgi_ad_algo_001",
    "title": "FGI - 커머스 및 소셜 플랫폼 내 광고와 추천알고리즘 사용 경험 토론 가이드",
    "instructions": "모더레이터 가이드: (1) 한 번에 한 문항씩 제시하고 발화 순서를 매 라운드마다 회전(랜덤/역순)하세요. (2) 각 발화는 60~90초 내, 구체적 사례·화면 맥락·행동 결과까지 요청하세요. (3) 공감/반박 유도 질문으로 상호대화를 만들되, 개인 신상·계정 정보는 요구하지 않습니다. (4) 중간마다 손들기(빠른 체크) 질문을 섞어 집단 감도를 파악하고, 마지막 라운드에는 수렴·우선순위화를 진행하세요. (5) 답변은 120단어(또는 3~5문장) 이내로 제한합니다.",
    "questions": [
      { "id": "q1", "text": "워밍업) 요즘 주로 이용하는 커머스/소셜/동영상 플랫폼은 무엇인가요? 그 안에서 광고와 추천 콘텐츠 노출 빈도를 체감상 어떻게 느끼시나요? (구체적 앱·탭·시간대)", "kind": "open" },
      { "id": "q2", "text": "광고) 최근 인상 깊었던 광고 또는 매우 불편했던 광고 하나를 떠올려 주세요. 어디에서, 무엇을 보고, 어떤 행동(클릭/무시/차단 등)으로 이어졌나요?", "kind": "open" },
      { "id": "q3", "text": "추천알고리즘) 추천된 상품/콘텐츠로 실제 구매/구독/참여까지 이어진 사례가 있나요? 계기(트리거)→탐색→의사결정→행동의 흐름을 짧게 설명해 주세요.", "kind": "open" },
      { "id": "q4", "text": "불일치/반감) 내 관심과 맞지 않거나 과도 반복으로 불쾌·불신을 느낀 사례가 있나요? 왜 그렇게 느꼈는지(표현·빈도·맥락·민감도)를 설명해 주세요.", "kind": "open" },
      { "id": "q5", "text": "영향) 광고/추천이 실제 서비스 이용 또는 구매 결정에 준 긍정/부정 영향은 무엇이었나요? 각각 1가지씩 사례 중심으로 말씀해 주세요.", "kind": "open" },
      { "id": "q6", "text": "개인화 적합도) 현재 사용하는 플랫폼들의 추천 정확도는 전반적으로 어느 정도라고 느끼시나요? (1=전혀 정확하지 않다, 7=매우 정확하다)", "kind": "scale", "scale_min": 1, "scale_max": 7 },
      { "id": "q7", "text": "광고 관련성) 내가 보는 광고의 ‘나와의 관련성’ 체감은 어느 정도인가요? (1=매우 낮다, 7=매우 높다)", "kind": "scale", "scale_min": 1, "scale_max": 7 },
      { "id": "q8", "text": "프라이버시 부담감) 개인화/맞춤화가 ‘사적 정보 노출’처럼 느껴지는 정도는? (1=전혀 부담 없음, 7=매우 부담됨)", "kind": "scale", "scale_min": 1, "scale_max": 7 },
      { "id": "q9", "text": "통제감) 원치 않는 광고/추천을 피하거나 조정할 수 있다는 ‘통제감’은 어느 정도인가요? (1=전혀 없다, 7=매우 크다)", "kind": "scale", "scale_min": 1, "scale_max": 7 },
      { "id": "q10", "text": "관리 전략) 광고 숨김/차단, ‘관심 없음’ 표시, 키워드/피드 설정 조정, 프리미엄 결제 등 본인의 관리 전략과 그 효과/한계를 알려주세요.", "kind": "open" },
      { "id": "q11", "text": "선호 광고 형식) 다음 중 상대적으로 허용/선호하는 광고 형식을 모두 선택해 주세요.", "kind": "multi", "options": ["피드 내 네이티브", "검색연동(스폰서)", "스토리/릴스/숏폼", "동영상 프리롤/미드롤", "라이브커머스", "인플루언서 협찬/브랜디드", "리타겟팅/다이내믹", "푸시/알림형", "기타"] },
      { "id": "q12", "text": "플랫폼별 차이) 커머스/소셜/동영상 등 플랫폼별 광고·추천 방식의 차이를 체감하시나요? 각 1가지씩 장점/단점을 비교해 주세요.", "kind": "open" },
      { "id": "q13", "text": "투명성/설명성) ‘왜 이 콘텐츠/광고를 보게 되었는지’ 알 수 있는 설명 기능의 필요성은? (1=전혀 필요 없음, 7=매우 필요)", "kind": "scale", "scale_min": 1, "scale_max": 7 },
      { "id": "q14", "text": "데이터 교환가치) 개인정보 제공 대비 얻는 편익(편의·발견·가격혜택 등)의 ‘가치’는 어느 정도로 느끼시나요? (1=매우 낮다, 7=매우 높다)", "kind": "scale", "scale_min": 1, "scale_max": 7 },
      { "id": "q15", "text": "개선 아이디어) 광고/추천 시스템에서 꼭 바꾸고 싶은 점 한 가지와 그 이유를 간단히 제안해 주세요. (구체적 UI/정책/알고리즘 단서 환영)", "kind": "open" },
      { "id": "q16", "text": "추가 의견) 오늘 다루지 못했지만 꼭 전하고 싶은 경험이나 의견이 있다면 자유롭게 말씀해 주세요.", "kind": "open" }
    ]
  }
  