{
  "id": "q_ind_001",
  "title": "개인 인터뷰 - 쇼핑 검색 경험 심층 설문",
  "instructions": "각 문항에 대해 본인의 실제 사용 경험을 바탕으로 솔직하게 답해주세요.",
  "questions": [
    { "id": "q1", "text": "귀하의 연령대를 선택해주세요.", "kind": "multi", "options": ["10대", "20대", "30대", "40대", "50대", "60대 이상"] },
    { "id": "q2", "text": "귀하의 성별을 선택해주세요.", "kind": "multi", "options": ["남성", "여성", "논바이너리", "응답 거부"] },
    { "id": "q3", "text": "귀하의 직업은 무엇인가요?", "kind": "open" },
    { "id": "q4", "text": "평소 디지털 기기 활용에 얼마나 익숙하신가요? (1=전혀, 7=매우)", "kind": "scale", "scale_min": 1, "scale_max": 7 },
    { "id": "q5", "text": "일주일에 평균적으로 온라인 쇼핑을 얼마나 자주 하시나요?", "kind": "multi", "options": ["거의 하지 않음", "주 1회 이하", "주 2~3회", "주 4~6회", "매일"] },
    { "id": "q6", "text": "주로 구매하시는 상품 카테고리를 모두 선택해주세요.", "kind": "multi", "options": ["의류/패션", "뷰티/화장품", "전자제품", "식품/생필품", "취미/레저", "도서/음반", "반려동물", "기타"] },
    { "id": "q7", "text": "월평균 온라인 쇼핑 지출액은 어느 정도인가요?", "kind": "multi", "options": ["5만원 미만", "5~10만원", "10~20만원", "20~30만원", "30~50만원", "50만원 이상"] },
    { "id": "q8", "text": "가장 자주 사용하는 온라인 쇼핑 플랫폼(앱/웹)을 순서대로 2개만 기입해주세요.", "kind": "open" },
    { "id": "q9", "text": "위 플랫폼을 주로 사용하는 가장 큰 이유는 무엇인가요? (1개 선택)", "kind": "multi", "options": ["가격이 저렴함", "배송이 빠름", "상품 구색이 넓음", "검색/필터가 편함", "리뷰 신뢰도", "브랜드 선호", "UI/UX 편의"] },

    { "id": "q10", "text": "오늘 쇼핑 플랫폼에 접속하기 전, 구매하고 싶은 상품이 있었나요, 아니면 둘러보기 위해 방문하셨나요?", "kind": "multi", "options": ["구체적으로 사고 싶은 상품이 있었다", "특별한 상품 없이 둘러보러 방문했다"] },

    { "id": "q11", "text": "쇼핑 플랫폼에 접속하기 전, 상품 관련 정보를 미리 찾아본 채널이 있다면 모두 선택해주세요.", "kind": "multi", "options": ["별도로 찾지 않음", "다른 쇼핑 플랫폼", "가격 비교 사이트", "포털 검색", "SNS/커뮤니티", "유튜브", "지인 추천", "기타"] },

    { "id": "q12", "text": "쇼핑 전, 외부 채널에서 주로 어떤 정보를 확인하나요? (복수 선택 가능)", "kind": "multi", "options": ["실제 사용 후기", "가격 비교", "스타일링/활용 참고", "제품 스펙", "프로모션/쿠폰", "재고/배송 정보", "확인 안함"] },

    { "id": "q13", "text": "검색을 시작할 때, 머릿속에 있던 아이디어(희망하는 상품의 조건 등)는 무엇이었나요?", "kind": "open" },
    { "id": "q14", "text": "상품을 찾기 위해 처음 입력한 검색어나 키워드는 무엇이었나요? 여러 개였다면 모두 적어주세요.", "kind": "open" },
    { "id": "q15", "text": "검색어 자동완성/연관검색어 기능이 도움이 되었던 적이 있다면, 어떤 점이 유용했나요?", "kind": "open" },
    { "id": "q16", "text": "오늘 검색 과정에서 검색어를 변경하거나 수정한 적이 있다면, 어떤 방식이었는지 적어주세요.", "kind": "open" },

    { "id": "q17", "text": "'가을 원피스 코디'처럼 긴 검색어(3단어 이상)를 최근 1개월 내 사용한 경험이 있으신가요?", "kind": "multi", "options": ["있다", "없다", "기억나지 않는다"] },

    { "id": "q18", "text": "텍스트 검색 이외의 방식(예: 이미지, 음성 등)을 사용해 상품을 찾은 경험이 있으신가요? (해당한다면 구체적인 상황을 적어주세요)", "kind": "open" },

    { "id": "q19", "text": "검색 결과 목록에서 상품을 확인할 때 가장 먼저 주목하는 정보는 무엇인가요? (1개 선택)", "kind": "multi", "options": ["상품 썸네일", "가격", "상품명/설명", "평점/리뷰 수", "배송/도착 예정일", "할인/쿠폰 표시", "브랜드", "광고/AD 표시"] },

    { "id": "q20", "text": "검색 결과에서 상품을 클릭하거나 자세히 볼 때, 중요하게 참고하는 정보(복수 선택 가능)는 무엇인가요?", "kind": "multi", "options": ["가격/할인", "평점/리뷰", "상세 이미지/영상", "사이즈/스펙", "배송/반품 정책", "재고/도착일", "브랜드/공식 여부"] },

    { "id": "q21", "text": "검색 결과 상단 혹은 첫 화면에서 '광고/AD' 표시 상품을 클릭한 적이 있으신가요?", "kind": "multi", "options": ["자주 클릭한다", "가끔 클릭한다", "별로 클릭하지 않는다", "인식하지 못했다"] },

    { "id": "q22", "text": "필터 기능(카테고리, 가격, 브랜드 등)을 사용해 검색 결과를 좁혀본 경험이 있으신가요?", "kind": "multi", "options": ["자주 사용", "가끔 사용", "거의 사용 안 함", "아예 사용 안 함"] },

    { "id": "q23", "text": "필터/정렬 기능을 사용할 때, 가장 많이 사용하는 항목을 모두 선택해주세요.", "kind": "multi", "options": ["카테고리", "가격 범위", "브랜드", "색상/사이즈", "판매자/공식스토어", "배송/오늘도착", "정품/리퍼/중고", "평점/리뷰 수", "별도 사용하지 않음"] },

    { "id": "q24", "text": "필터나 정렬 기능을 사용하면서 불편했던 경험이 있다면 구체적으로 알려주세요.", "kind": "open" },

    { "id": "q25", "text": "검색 결과가 본인이 의도한 상품과 다르게 나와 당황하거나 재검색했던 경험이 있다면, 그때 어떻게 해결하셨나요?", "kind": "open" },

    { "id": "q26", "text": "원하는 상품을 찾기까지 전체적으로 얼마나 복잡하게 느꼈는지 (1=매우 쉬움, 7=매우 복잡)", "kind": "scale", "scale_min": 1, "scale_max": 7 },

    { "id": "q27", "text": "'맞춤 상품' 등 추천 영역을 평소 인지하셨나요?", "kind": "multi", "options": ["항상 본다", "가끔 본다", "잘 보지 않는다", "모르겠다"] },

    { "id": "q28", "text": "쇼핑 플랫폼 내 추천 상품(혹은 영역)에서 최근 한 달간 구매 또는 관심을 보인 적이 있으신가요?", "kind": "multi", "options": ["구매한 적 있다", "찜/스크랩한 적 있다", "관심만 있었음", "관심없음"] },

    { "id": "q29", "text": "오늘 이 플랫폼에서의 전반적인 검색/쇼핑 경험에 얼마나 만족하시나요? 그 이유도 간단히 알려주세요.", "kind": "open" },

    { "id": "q30", "text": "예상했던 상품이나 대안을 찾으셨나요?", "kind": "multi", "options": ["원하는 상품 구매", "만족스러운 대안 선택", "찾지 못했다"] },

    { "id": "q31", "text": "상품 리뷰를 확인할 때, 부정적인 내용 위주로 따로 찾아본 경험이 있으신가요?", "kind": "multi", "options": ["자주 있다", "가끔 있다", "거의 없음", "잘 기억나지 않는다"] },

    { "id": "q32", "text": "상품 관련 정보(상세설명, 사진, 리뷰 등)가 부족하여 구매를 망설였던 상황이 있다면, 어떤 정보가 부족했나요?", "kind": "open" },

    { "id": "q33", "text": "여러 후보 중 최종적으로 한 상품을 선택할 때 가장 결정적이었던 요인은 무엇인가요? (복수 선택 가능)", "kind": "multi", "options": ["가격/할인", "평점/리뷰", "상세 이미지/영상", "배송/반품 정책", "브랜드", "그 외(직접 입력)"] },

    { "id": "q34", "text": "구매를 포기하거나 장바구니에 담지 않은 이유가 있다면, 자유롭게 적어주세요.", "kind": "open" },

    { "id": "q35", "text": "오늘 검색/쇼핑 과정을 마친 뒤, 실제로 어떤 행동을 하셨나요? (복수 선택 가능)", "kind": "multi", "options": ["구매 완료", "장바구니 담기", "위시리스트/스크랩", "다른 플랫폼으로 비교 이동", "세션 종료/이탈", "지인에게 공유"] },

    { "id": "q36", "text": "쇼핑 과정에서 최근 1개월 내 두 개 이상의 쇼핑 플랫폼을 같이 이용한 적이 있으신가요?", "kind": "multi", "options": ["네, 자주 있다", "가끔 있다", "거의 없음", "기억 안 남"] },

    { "id": "q37", "text": "상품을 결정하거나 구매할 때 타인의 의견(리뷰, 지인추천 등)을 어느 정도 참고하시나요? (1=전혀 참고하지 않음, 7=항상 참고)", "kind": "scale", "scale_min": 1, "scale_max": 7 },

    { "id": "q38", "text": "구매 전 실제 상품을 오프라인 매장에서 확인한 경험이 최근 6개월 내 있었나요?", "kind": "multi", "options": ["자주 있다", "가끔 있다", "거의 없음", "없음"] },

    { "id": "q39", "text": "최근 온라인 쇼핑에서 정보 부족, 불신, 혼란 등으로 인해 결정을 미루거나 포기한 경험이 있으신가요?", "kind": "multi", "options": ["자주 있다", "가끔 있다", "거의 없다", "없다"] },
    { "id": "q40", "text": "오늘의 검색/쇼핑 경험이 해당 플랫폼을 다시 사용할 의사에 영향을 미쳤다고 본인의 생각을 자유롭게 서술해주세요.", "kind": "open" }
  ]
}
  