{
  "id": "q_ind_legal_search",
  "title": "개인 인터뷰 - 법률 문제 해결 및 변호사 탐색 여정",
  "instructions": "각 문항에 대해 귀하가 겪었거나 상상하는 법률 문제 해결 과정을 바탕으로 솔직하게 답해주세요.",
  "questions": [
    { "id": "q1", "text": "귀하의 연령대를 선택해주세요.", "kind": "multi", "options": ["20대", "30대", "40대", "50대", "60대 이상"] },
    { "id": "q2", "text": "최근 3년 내에 내용증명 발송이나 법률 상담이 필요한 문제를 겪은 적이 있나요?", "kind": "multi", "options": ["있다", "없다"] },
    { "id": "q3", "text": "(있다면) 어떤 종류의 문제였나요? (예: 임대차 보증금, 미수금, 모욕/명예훼손, 환불 분쟁 등)", "kind": "open" },
    { "id": "q4", "text": "법률 문제가 발생했을 때, 가장 먼저 든 생각이나 감정은 무엇이었나요? (예: 막막함, 억울함, 비용 걱정, 귀찮음)", "kind": "open" },
    { "id": "q5", "text": "해결 방법을 찾기 위해 처음 입력한 검색어는 무엇이었나요?", "kind": "open" },
    { "id": "q6", "text": "검색 결과 중 가장 먼저 클릭하게 되는 콘텐츠 유형은? (1개 선택)", "kind": "multi", "options": ["변호사/로펌 광고 파워링크", "네이버 블로그/포스트(해결 사례)", "지식인/카페 Q&A", "뉴스 기사", "유튜브 영상"] },
    { "id": "q7", "text": "'내용증명'을 작성해야 한다고 했을 때, 가장 큰 장벽은 무엇인가요? (복수 선택)", "kind": "multi", "options": ["어떻게 써야 할지 모르겠다(양식/형식)", "변호사 비용이 비쌀 것 같다", "상대방 기분을 너무 상하게 할까 봐", "법적 효력이 있을지 의심되어서", "절차가 복잡하고 귀찮아서"] },
    { "id": "q8", "text": "온라인 간편 내용증명 서비스(작성 대행)를 이용해본 적이 있거나, 이용할 의향이 있나요?", "kind": "multi", "options": ["이용해 본 적 있다", "알고 있고 이용 의향 있다", "몰랐지만 이용 의향 있다", "이용 의향 없다(직접 하거나 변호사 방문)"] },
    { "id": "q9", "text": "변호사 이름으로 발송되는 내용증명 서비스의 적정 가격대는 얼마라고 생각하시나요?", "kind": "multi", "options": ["5만원 미만", "5~10만원", "10~20만원", "20~30만원", "30만원 이상"] },
    { "id": "q10", "text": "서비스 이용 시 가장 중요하게 고려하는 요소 1순위는?", "kind": "multi", "options": ["저렴한 비용", "작성 편의성(자동 완성 등)", "변호사 검수 여부", "빠른 발송 속도", "사후 관리(답변서 대응 등)"] },
    { "id": "q11", "text": "법적 분쟁 해결 과정에서 가장 도움을 받고 싶은 부분은 무엇인가요? (예: 증거 수집 방법, 상대방 심리 압박, 법리적 검토 등)", "kind": "open" },
    { "id": "q12", "text": "현재의 법률 서비스 시장이나 변호사 탐색 과정에서 가장 불편하다고 느끼는 점은 무엇인가요?", "kind": "open" },
    { "id": "q13", "text": "법률 문제를 겪었을 때 주변(가족·지인 등)에게 조언을 구한 경험이 있나요? 어떤 이야기를 들었나요?", "kind": "open" },
    { "id": "q14", "text": "법률 관련 정보를 찾을 때 가장 신뢰하게 되는 정보원은 무엇인가요?", "kind": "multi", "options": ["변호사/법무법인 공식 홈페이지", "정부·공공기관 사이트", "네이버 지식인/카페", "지인 추천", "언론 기사", "SNS/커뮤니티"] },
    { "id": "q15", "text": "변호사를 직접 방문해서 상담받은 경험이 있나요? 만족도와 불편사항은?", "kind": "open" },
    { "id": "q16", "text": "온라인 법률 서비스(플랫폼/앱 등) 이용 경험이 있다면 어떤 점이 편리했고, 어떤 점이 아쉬웠나요?", "kind": "open" },
    { "id": "q17", "text": "내용증명·법률문서 제공 서비스에서 가장 신뢰를 주는 요소는 무엇이라고 생각하나요?", "kind": "multi", "options": ["변호사 실명/사진 공개", "실제 이용 후기", "환불/보장 정책", "사이트 디자인", "누적 발송 건수", "언론보도/제휴"] },
    { "id": "q18", "text": "법률 서비스 이용 시 부담되는 요소를 모두 골라주세요.", "kind": "multi", "options": ["비용 부담", "전문용어 이해 어려움", "절차가 복잡함", "상담 시간 부족", "사생활 노출 우려", "불친절/성의 없는 응대"] },
    { "id": "q19", "text": "서비스 가격 할인, 환불보장, 24시간 응답 등과 같은 혜택이 결정에 어느 정도 영향을 미칠까요? (1=영향 없음, 7=결정적 영향)", "kind": "scale", "scale_min": 1, "scale_max": 7 },
    { "id": "q20", "text": "앱/온라인을 통한 법률 서비스 이용 시 불안감을 느낀 적 있나요? 느꼈다면 어떤 점이 그렇고, 어떤 부분이 보완되면 좋을까요?", "kind": "open" }
  ]
}
